ticker,title,summary,publisher,link,publish_date,type,related_tickers,source,overall_sentiment_score,overall_sentiment_label,category
^IXIC,"S&P 500 Closes at Record High, Oil Falls as Traders Parse Trump Comments",No summary available.,MT Newswires,https://finance.yahoo.com/news/p-500-closes-record-high-213627406.html,2025-01-23 14:36:27,STORY,"^GSPC, COMP",yahoo,0.4,Bullish,General
^IXIC,"How major US stock indexes fared Thursday, 1/23/2025",No summary available.,Associated Press,https://finance.yahoo.com/news/major-us-stock-indexes-fared-211814315.html,2025-01-23 14:18:14,STORY,"COMP, ^DJI, ^GSPC, ^RUT",yahoo,0.4,Bullish,General
^IXIC,"Stock market today: S&P 500 clinches first record close of 2025, Dow pops after Trump takes spotlight at Davos",No summary available.,Yahoo Finance,https://finance.yahoo.com/news/live/stock-market-today-sp-500-clinches-first-record-close-of-2025-dow-pops-after-trump-takes-spotlight-at-davos-210311077.html,2025-01-23 14:03:11,STORY,"ES=F, ^IXIC, ^DJI, NQ=F, ^GSPC, YM=F",yahoo,0.4,Bullish,General
^IXIC,Trump Comments Leave Equity Markets Mixed,No summary available.,MT Newswires,https://finance.yahoo.com/news/trump-comments-leave-equity-markets-205020322.html,2025-01-23 13:50:20,STORY,"COMP, ^GSPC, ^DJI",yahoo,0.4,Bullish,General
^IXIC,Trump Comments Leave Equities Mixed Intraday,No summary available.,MT Newswires,https://finance.yahoo.com/news/trump-comments-leave-equities-mixed-185441569.html,2025-01-23 11:54:41,STORY,"^GSPC, COMP",yahoo,0.4,Bullish,General
^DJI,"How major US stock indexes fared Thursday, 1/23/2025",No summary available.,Associated Press,https://finance.yahoo.com/news/major-us-stock-indexes-fared-211814315.html,2025-01-23 14:18:14,STORY,"COMP, ^DJI, ^GSPC, ^RUT",yahoo,0.4,Bullish,General
^DJI,"Stock market today: S&P 500 clinches first record close of 2025, Dow pops after Trump takes spotlight at Davos",No summary available.,Yahoo Finance,https://finance.yahoo.com/news/live/stock-market-today-sp-500-clinches-first-record-close-of-2025-dow-pops-after-trump-takes-spotlight-at-davos-210311077.html,2025-01-23 14:03:11,STORY,"ES=F, ^IXIC, ^DJI, NQ=F, ^GSPC, YM=F",yahoo,0.4,Bullish,General
^DJI,"Top Cryptocurrencies Fall; Bitcoin Drops Below $104,000 Level",No summary available.,MT Newswires,https://finance.yahoo.com/news/top-cryptocurrencies-fall-bitcoin-drops-210004065.html,2025-01-23 14:00:04,STORY,"^GSPC, ^DJI",yahoo,0.4,Bullish,General
^DJI,Trump Comments Leave Equity Markets Mixed,No summary available.,MT Newswires,https://finance.yahoo.com/news/trump-comments-leave-equity-markets-205020322.html,2025-01-23 13:50:20,STORY,"COMP, ^GSPC, ^DJI",yahoo,0.4,Bullish,General
^DJI,US Equity Indexes Mixed as Technology Slips Amid Gains in Treasury Yields,No summary available.,MT Newswires,https://finance.yahoo.com/news/us-equity-indexes-mixed-technology-182320372.html,2025-01-23 11:23:20,STORY,"COMP, ^GSPC, ^DJI",yahoo,0.4,Bullish,General
^RUT,"How major US stock indexes fared Thursday, 1/23/2025",No summary available.,Associated Press,https://finance.yahoo.com/news/major-us-stock-indexes-fared-211814315.html,2025-01-23 14:18:14,STORY,"COMP, ^DJI, ^GSPC, ^RUT",yahoo,0.4,Bullish,General
^RUT,Initial Claims Higher-Than-Estimates,No summary available.,Zacks,https://finance.yahoo.com/news/initial-claims-higher-estimates-155300236.html,2025-01-23 08:53:00,STORY,"^RUT, ^GSPC",yahoo,0.4,Bullish,General
^RUT,"Pre-Markets Seek Direction on Warmer Jobless Claims, Q4 Earnings",No summary available.,Zacks,https://finance.yahoo.com/news/pre-markets-seek-direction-warmer-153200988.html,2025-01-23 08:32:00,STORY,"^RUT, ^GSPC",yahoo,0.4,Bullish,General
^RUT,Should Vanguard Russell 2000 Value ETF (VTWV) Be on Your Investing Radar?,No summary available.,Zacks,https://finance.yahoo.com/news/vanguard-russell-2000-value-etf-112008096.html,2025-01-23 04:20:08,STORY,^RUT,yahoo,0.4,Bullish,General
^RUT,S&P 500 Closes Within Striking Distance of Record: Markets Wrap,No summary available.,Bloomberg,https://finance.yahoo.com/news/asia-stocks-set-gain-trump-223617478.html,2025-01-22 14:36:48,STORY,"^RUT, ^DJI",yahoo,0.4,Bullish,General
^RUT,"How major US stock indexes fared Wednesday, 1/22/2025",No summary available.,Associated Press,https://finance.yahoo.com/news/major-us-stock-indexes-fared-212058832.html,2025-01-22 14:20:58,STORY,"COMP, ^GSPC, ^DJI, ^RUT",yahoo,0.4,Bullish,General
^GSPC,Asian Shares Track Wall Street Optimism Before BOJ: Markets Wrap,No summary available.,Bloomberg,https://finance.yahoo.com/news/asian-shares-ride-wall-street-224004019.html,2025-01-23 17:16:41,STORY,^GSPC,yahoo,0.4,Bullish,General
^GSPC,Why Prologis Stock Was a Winner on Thursday,No summary available.,Motley Fool,https://finance.yahoo.com/m/3eaea4ff-1238-3bd0-84c5-ef7aedf91b70/why-prologis-stock-was-a.html,2025-01-23 16:01:43,STORY,"PLD, ^GSPC",yahoo,0.4,Bullish,General
^GSPC,BRF (BRFS) Stock Falls Amid Market Uptick: What Investors Need to Know,No summary available.,Zacks,https://finance.yahoo.com/news/brf-brfs-stock-falls-amid-230024316.html,2025-01-23 16:00:24,STORY,"^GSPC, BRFS",yahoo,0.4,Bullish,General
^GSPC,Cloudflare (NET) Rises Higher Than Market: Key Facts,No summary available.,Zacks,https://finance.yahoo.com/news/cloudflare-net-rises-higher-market-230024297.html,2025-01-23 16:00:24,STORY,"NET, ^GSPC",yahoo,0.4,Bullish,General
^GSPC,Monday.com (MNDY) Stock Drops Despite Market Gains: Important Facts to Note,No summary available.,Zacks,https://finance.yahoo.com/news/monday-com-mndy-stock-drops-230023207.html,2025-01-23 16:00:23,STORY,"^GSPC, MNDY",yahoo,0.4,Bullish,General
^GSPC,Cadence Design Systems (CDNS) Outperforms Broader Market: What You Need to Know,No summary available.,Zacks,https://finance.yahoo.com/news/cadence-design-systems-cdns-outperforms-230022774.html,2025-01-23 16:00:22,STORY,"CDNS, ^GSPC",yahoo,0.4,Bullish,General
^GSPC,Gold Fields (GFI) Gains But Lags Market: What You Should Know,No summary available.,Zacks,https://finance.yahoo.com/news/gold-fields-gfi-gains-lags-230021576.html,2025-01-23 16:00:21,STORY,"GFI, ^GSPC",yahoo,0.4,Bullish,General
AAPL,"Update: Epic Games Takes on Google, Apple With Third-Party Games on Company's Own App Marketplace",No summary available.,MT Newswires,https://finance.yahoo.com/news/epic-games-takes-google-apple-224128923.html,2025-01-23 15:41:28,STORY,"AAPL, GOOG",yahoo,0.4,Bullish,Tech
AAPL,Former Apple Executive Asks $25.5 Million for San Francisco Apartment,No summary available.,The Wall Street Journal,https://finance.yahoo.com/m/d6ad7585-fc9b-3f5f-9207-11c2c3f75d3c/former-apple-executive-asks.html,2025-01-23 15:00:00,STORY,AAPL,yahoo,0.4,Bullish,Tech
AAPL,Trump opens a divide between US and EU over Big Tech,No summary available.,Yahoo Finance,https://finance.yahoo.com/news/trump-opens-a-divide-between-us-and-eu-over-big-tech-213413056.html,2025-01-23 14:34:13,STORY,"GOOG, META, MSFT, AAPL, AMZN",yahoo,0.4,Bullish,Tech
AAPL,"Apple Poised for Largely In-Line First-Quarter Revenue, Morgan Stanley Says",No summary available.,MT Newswires,https://finance.yahoo.com/news/apple-poised-largely-line-first-204840044.html,2025-01-23 13:48:40,STORY,AAPL,yahoo,0.4,Bullish,Tech
AAPL,"As Apple Earnings Near, More Investors Think the iPhone Maker’s Stock Is Primed to Fall",No summary available.,Barrons.com,https://finance.yahoo.com/m/6ec2f756-d24d-3154-a494-c4f23da4bd4f/as-apple-earnings-near%2C-more.html,2025-01-23 13:24:00,STORY,AAPL,yahoo,0.4,Bullish,Tech
AAPL,Is Apple Inc. (AAPL) Among Billionaire Dan Loeb’s Top Stock Picks?,No summary available.,Insider Monkey,https://finance.yahoo.com/news/apple-inc-aapl-among-billionaire-195410392.html,2025-01-23 12:54:10,STORY,"AAPL, TPNTF",yahoo,0.4,Bullish,Tech
AAPL,"Epic Games Takes on Google, Apple With Third-Party Games on Company's Own App Marketplace",No summary available.,MT Newswires,https://finance.yahoo.com/news/epic-games-takes-google-apple-194817735.html,2025-01-23 12:48:17,STORY,"GOOG, AAPL",yahoo,0.4,Bullish,Tech
AAPL,"India Urges Apple, Google to Host Government App Suite Amid Resistance",No summary available.,GuruFocus.com,https://finance.yahoo.com/news/india-urges-apple-google-host-185435371.html,2025-01-23 11:54:35,STORY,"GOOG, AAPL",yahoo,0.4,Bullish,Tech
GOOGL,"Update: Epic Games Takes on Google, Apple With Third-Party Games on Company's Own App Marketplace",No summary available.,MT Newswires,https://finance.yahoo.com/news/epic-games-takes-google-apple-224128923.html,2025-01-23 15:41:28,STORY,"AAPL, GOOG",yahoo,0.4,Bullish,Tech
GOOGL,Trump opens a divide between US and EU over Big Tech,No summary available.,Yahoo Finance,https://finance.yahoo.com/news/trump-opens-a-divide-between-us-and-eu-over-big-tech-213413056.html,2025-01-23 14:34:13,STORY,"GOOG, META, MSFT, AAPL, AMZN",yahoo,0.4,Bullish,Tech
GOOGL,"IBD 50 Stock In Huge Demand — With Ties To Shopify, Google And Meta",No summary available.,Investor's Business Daily,https://finance.yahoo.com/m/aed87e43-725f-39b2-8531-1c08e0b941e7/ibd-50-stock-in-huge-demand-%E2%80%94.html,2025-01-23 13:37:35,STORY,"META, GLBE, GOOG, CRM, SHOP",yahoo,0.4,Bullish,Tech
GOOGL,Is Alphabet Inc. (GOOGL) the Best Socially Responsible Stock to Buy According to Hedge Funds?,No summary available.,Insider Monkey,https://finance.yahoo.com/news/alphabet-inc-googl-best-socially-202310113.html,2025-01-23 13:23:10,STORY,GOOG,yahoo,0.4,Bullish,Tech
GOOGL,"Epic Games Takes on Google, Apple With Third-Party Games on Company's Own App Marketplace",No summary available.,MT Newswires,https://finance.yahoo.com/news/epic-games-takes-google-apple-194817735.html,2025-01-23 12:48:17,STORY,"GOOG, AAPL",yahoo,0.4,Bullish,Tech
GOOGL,"India Urges Apple, Google to Host Government App Suite Amid Resistance",No summary available.,GuruFocus.com,https://finance.yahoo.com/news/india-urges-apple-google-host-185435371.html,2025-01-23 11:54:35,STORY,"GOOG, AAPL",yahoo,0.4,Bullish,Tech
GOOGL,"Apple 2025 Outlook: AI Gets IQ Boost, Possible Smart Home Products",No summary available.,Investor's Business Daily,https://finance.yahoo.com/m/0df94b1f-418c-3bdb-9d48-4ec50838622f/apple-2025-outlook%3A-ai-gets.html,2025-01-23 11:46:55,STORY,"AMZN, AAPL, META, GOOG",yahoo,0.4,Bullish,Tech
GOOGL,Researchers just stumped AI with their most difficult test — but for how long?,No summary available.,Quartz,https://finance.yahoo.com/m/d30567e5-9a57-37bc-a44c-fc2bda988228/researchers-just-stumped-ai.html,2025-01-23 11:43:07,STORY,GOOG,yahoo,0.4,Bullish,Tech
MSFT,Tevogen Bio Highlights the Future of AI-Driven Drug Development in Fireside Chat with Microsoft During the J.P. Morgan Healthcare Conference,No summary available.,GlobeNewswire,https://finance.yahoo.com/news/tevogen-bio-highlights-future-ai-005300691.html,2025-01-23 17:53:00,STORY,"TVGN, TVGNW, MSFT",yahoo,0.4,Bullish,Tech
MSFT,Trump opens a divide between US and EU over Big Tech,No summary available.,Yahoo Finance,https://finance.yahoo.com/news/trump-opens-a-divide-between-us-and-eu-over-big-tech-213413056.html,2025-01-23 14:34:13,STORY,"GOOG, META, MSFT, AAPL, AMZN",yahoo,0.4,Bullish,Tech
MSFT,Sector Update: Tech Stocks Edge Lower Late Afternoon,No summary available.,MT Newswires,https://finance.yahoo.com/news/sector-tech-stocks-edge-lower-205709720.html,2025-01-23 13:57:09,STORY,"EBAY, MSFT",yahoo,0.4,Bullish,Tech
MSFT,Sector Update: Tech,No summary available.,MT Newswires,https://finance.yahoo.com/news/sector-tech-204124549.html,2025-01-23 13:41:24,STORY,"EBAY, MSFT",yahoo,0.4,Bullish,Tech
MSFT,HP stockpiling computers ahead of potential Trump tariffs: CEO,No summary available.,Yahoo Finance,https://finance.yahoo.com/news/hp-stockpiling-computers-ahead-of-potential-trump-tariffs-ceo-203002131.html,2025-01-23 13:30:02,STORY,"MSFT, AMD, NVDA, BBY, DELL, HPQ, INTC",yahoo,0.4,Bullish,Tech
MSFT,Is Microsoft Corporation (MSFT) Among Billionaire Dan Loeb’s Top Stock Picks?,No summary available.,Insider Monkey,https://finance.yahoo.com/news/microsoft-corporation-msft-among-billionaire-195046386.html,2025-01-23 12:50:46,STORY,"MSFT, TPNTF",yahoo,0.4,Bullish,Tech
MSFT,Microsoft Stock Approaches This Early Entry Point; Is MSFT A Buy In January?,No summary available.,Investor's Business Daily,https://finance.yahoo.com/m/5dd00a9b-8305-3862-b01d-ed9edac80eb4/microsoft-stock-approaches.html,2025-01-23 12:50:01,STORY,MSFT,yahoo,0.4,Bullish,Tech
MSFT,Market Chatter: Microsoft to Train 1 Million South Africans on AI & Cybersecurity by 2026,No summary available.,MT Newswires,https://finance.yahoo.com/news/market-chatter-microsoft-train-1-193338908.html,2025-01-23 12:33:38,STORY,MSFT,yahoo,0.4,Bullish,Tech
ASTS,AST SpaceMobile Announces Pricing of Private Offering of $400.0 Million of Convertible Senior Notes Due 2032,No summary available.,Business Wire,https://finance.yahoo.com/news/ast-spacemobile-announces-pricing-private-054700445.html,2025-01-22 22:47:00,STORY,"ASTS, ASTSW",yahoo,0.4,Bullish,Tech
ASTS,AST SpaceMobile Announces Proposed Private Offering of $400.0 Million of Convertible Senior Notes Due 2032,No summary available.,Business Wire,https://finance.yahoo.com/news/ast-spacemobile-announces-proposed-private-212700566.html,2025-01-22 14:27:00,STORY,"ASTS, ASTSW",yahoo,0.4,Bullish,Tech
PTON,"Peloton Interactive, Inc. Announces Date of Second Quarter 2025 Earnings Release and Conference Call",No summary available.,GlobeNewswire,https://finance.yahoo.com/news/peloton-interactive-inc-announces-date-210000179.html,2025-01-23 14:00:00,STORY,PTON,yahoo,0.4,Bullish,Tech
PTON,What Makes Peloton Interactive (PTON) an Investment Bet?,No summary available.,Insider Monkey,https://finance.yahoo.com/news/makes-peloton-interactive-pton-investment-141745759.html,2025-01-23 07:17:45,STORY,"PTON, GLRE",yahoo,0.4,Bullish,Tech
PTON,Einhorn says the market is at the fartcoin stage of the cycle. His fund bought Peloton and made these moves.,No summary available.,MarketWatch,https://finance.yahoo.com/m/354a6057-ffb8-359a-a4cd-8ad868b2f8d2/einhorn-says-the-market-is-at.html,2025-01-22 07:35:00,STORY,PTON,yahoo,0.4,Bullish,Tech
PTON,Here's Why Investors Should Retain Peloton Stock for Now,No summary available.,Zacks,https://finance.yahoo.com/news/heres-why-investors-retain-peloton-124500555.html,2025-01-22 05:45:00,STORY,"PTON, CUK",yahoo,0.4,Bullish,Tech
GSAT,"Globalstar Plans to Voluntarily Delist from NYSE American, Transfer to Nasdaq",No summary available.,MT Newswires,https://finance.yahoo.com/news/globalstar-plans-voluntarily-delist-nyse-090443312.html,2025-01-22 02:04:43,STORY,GSAT,yahoo,0.4,Bullish,Tech
PLTR,"Palantir Could Ride AI Fed Spending 'Tidal Wave,' Says Analyst",No summary available.,Investor's Business Daily,https://finance.yahoo.com/m/5ee1a2f0-2b87-33ef-96ef-ae373ab96aaf/palantir-could-ride-ai-fed.html,2025-01-23 15:10:31,STORY,PLTR,yahoo,0.4,Bullish,Tech
PLTR,Find The Next Palantir Or Hot IPO In 2025 With This Tool,No summary available.,Investor's Business Daily,https://finance.yahoo.com/m/3ea1184c-5a73-3eb6-9e62-aab9dda34953/find-the-next-palantir-or-hot.html,2025-01-23 13:48:01,STORY,"KVYO, PLTR, NVDA, RDDT, ODD",yahoo,0.4,Bullish,Tech
PLTR,Dow Jones Futures: AI Stocks Fall After Running On Trump's 'Stargate' Project,No summary available.,Investor's Business Daily,https://finance.yahoo.com/m/af4be1e4-3aa1-3d6f-ad36-0e042795d1d6/dow-jones-futures%3A-ai-stocks.html,2025-01-23 06:11:18,STORY,"CRWD, PLTR, NVDA, ARM, ORCL",yahoo,0.4,Bullish,Tech
PLTR,"Nvidia, Palantir And Google Fuel This List Of 23 'Perfect' Stocks",No summary available.,Investor's Business Daily,https://finance.yahoo.com/m/8980de89-7192-33f0-9ef0-1182d1acd5be/nvidia%2C-palantir-and-google.html,2025-01-22 13:55:21,STORY,"META, GOOG, NFLX, NVDA, AVGO, PLTR",yahoo,0.4,Bullish,Tech
PLTR,Does Palantir Technologies (NASDAQ:PLTR) Deserve A Spot On Your Watchlist?,No summary available.,Simply Wall St.,https://finance.yahoo.com/news/does-palantir-technologies-nasdaq-pltr-140012935.html,2025-01-22 07:00:12,STORY,PLTR,yahoo,0.4,Bullish,Tech
SMR,When Should You Buy NuScale Power Corporation (NYSE:SMR)?,No summary available.,Simply Wall St.,https://finance.yahoo.com/news/buy-nuscale-power-corporation-nyse-142101725.html,2025-01-23 07:21:01,STORY,SMR,yahoo,0.4,Bullish,Tech
SMR,Cathie Wood Dumps Sam Altman's Surging Nuclear Startup; Buys Key Uranium Player,No summary available.,Investor's Business Daily,https://finance.yahoo.com/m/cce8d1ae-275d-3f72-9338-c23a37ee03a9/cathie-wood-dumps-sam.html,2025-01-22 15:42:20,STORY,"VST, OKLO, NNE, CCJ, SMR",yahoo,0.4,Bullish,Tech
ACHR,Lt. Gen. (Ret) Scott Howell Joins Archer Defense’s Advisory Board to Advance Next-Gen Military Program,No summary available.,Business Wire,https://finance.yahoo.com/news/lt-gen-ret-scott-howell-133000679.html,2025-01-22 06:30:00,STORY,"ACHR, ACHR-WS",yahoo,0.4,Bullish,Tech
AMD,HP stockpiling computers ahead of potential Trump tariffs: CEO,No summary available.,Yahoo Finance,https://finance.yahoo.com/news/hp-stockpiling-computers-ahead-of-potential-trump-tariffs-ceo-203002131.html,2025-01-23 13:30:02,STORY,"MSFT, AMD, NVDA, BBY, DELL, HPQ, INTC",yahoo,0.4,Bullish,Tech
AMD,Chip stocks fall as Nvidia supplier highlights market uncertainty,No summary available.,Yahoo Finance,https://finance.yahoo.com/news/chip-stocks-fall-as-nvidia-supplier-highlights-market-uncertainty-150914100.html,2025-01-23 08:09:14,STORY,"AVGO, 000660.KS, AMD, NVDA, ARM, MU, ^SOX",yahoo,0.4,Bullish,Tech
AMD,Is AI out of control? HPE CEO says it's up in the air.,No summary available.,Yahoo Finance,https://finance.yahoo.com/news/is-ai-out-of-control-hpe-ceo-says-its-up-in-the-air-150002290.html,2025-01-23 08:00:02,STORY,"NVDA, DELL, META, AMD, CRM, HPE, HPQ, TSLA, AMZN, SMCI, ^IXIC",yahoo,0.4,Bullish,Tech
AMD,Where Will AMD Stock Be in 3 Years?,No summary available.,Motley Fool,https://finance.yahoo.com/m/004f4895-54cf-35c4-9f6c-4b35ea824fd4/where-will-amd-stock-be-in-3.html,2025-01-23 07:15:00,STORY,"AMD, NVDA, MSFT",yahoo,0.4,Bullish,Tech
AMD,"Social Buzz: Wallstreetbets Stocks Mostly Lower Premarket Thursday; AST SpaceMobile, Trump Media & Technology Group to Decline",No summary available.,MT Newswires,https://finance.yahoo.com/news/social-buzz-wallstreetbets-stocks-mostly-120559447.html,2025-01-23 05:05:59,STORY,AMD,yahoo,0.4,Bullish,Tech
AMD,"The Zacks Analyst Blog NVIDIA, Palantir, Microsoft, Intel and Advanced Micro Devices",No summary available.,Zacks,https://finance.yahoo.com/news/zacks-analyst-blog-nvidia-palantir-083300281.html,2025-01-23 01:33:00,STORY,"NVDA, MSFT, INTC, AMD",yahoo,0.4,Bullish,Tech
AMD,Jim Cramer on Advanced Micro Devices (AMD): “Cut by Goldman and Struggling to Accelerate Growth – Here’s Why”,No summary available.,Insider Monkey,https://finance.yahoo.com/news/jim-cramer-advanced-micro-devices-005626503.html,2025-01-22 17:56:26,STORY,AMD,yahoo,0.4,Bullish,Tech
NVDA,Nvidia (NVDA) Advances But Underperforms Market: Key Facts,No summary available.,Zacks,https://finance.yahoo.com/news/nvidia-nvda-advances-underperforms-market-224520374.html,2025-01-23 15:45:20,STORY,NVDA,yahoo,0.4,Bullish,Tech
NVDA,The Trump-Musk Bromance Is as Strong as Ever Despite Tesla CEO’s Stargate Diss,No summary available.,Barrons.com,https://finance.yahoo.com/m/7f8f9de8-7e66-3265-86a9-f5e837271050/the-trump-musk-bromance-is-as.html,2025-01-23 14:36:00,STORY,"TSLA, ORCL, NVDA",yahoo,0.4,Bullish,Tech
NVDA,"Stock Market Today: Indexes Mixed As Trump Makes These Demands; Quantum Computing Stock Falls As Apple, Tesla Earnings Loom (Live Coverage)",No summary available.,Investor's Business Daily,https://finance.yahoo.com/m/96999a20-6604-3b5a-904a-8a8aec50f0f6/stock-market-today%3A-indexes.html,2025-01-23 14:30:22,STORY,"ARM, AAL, GE, ELV, NVDA",yahoo,0.4,Bullish,Tech
NVDA,"These Stocks Moved the Most Today: Electronic Arts, Nvidia, Arm, GE Aerospace, American Airlines, Union Pacific, and More",No summary available.,Barrons.com,https://finance.yahoo.com/m/68b71a08-8645-31ce-ab9d-08cc706c2d43/these-stocks-moved-the-most.html,2025-01-23 14:28:00,STORY,"NVDA, KNX, AA",yahoo,0.4,Bullish,Tech
NVDA,Find The Next Palantir Or Hot IPO In 2025 With This Tool,No summary available.,Investor's Business Daily,https://finance.yahoo.com/m/3ea1184c-5a73-3eb6-9e62-aab9dda34953/find-the-next-palantir-or-hot.html,2025-01-23 13:48:01,STORY,"KVYO, PLTR, NVDA, RDDT, ODD",yahoo,0.4,Bullish,Tech
NVDA,HP stockpiling computers ahead of potential Trump tariffs: CEO,No summary available.,Yahoo Finance,https://finance.yahoo.com/news/hp-stockpiling-computers-ahead-of-potential-trump-tariffs-ceo-203002131.html,2025-01-23 13:30:02,STORY,"MSFT, AMD, NVDA, BBY, DELL, HPQ, INTC",yahoo,0.4,Bullish,Tech
NVDA,Why Micron (MU) Stock Is Nosediving,No summary available.,StockStory,https://finance.yahoo.com/news/why-micron-mu-stock-nosediving-200717207.html,2025-01-23 13:07:17,STORY,"NVDA, MU",yahoo,0.4,Bullish,Tech
NVDA,"Elon Musk Says Project Stargate Doesn't 'Actually Have The Money' After Trump Announces $500 Billion AI Investment Led By SoftBank, Oracle And OpenAI",No summary available.,Benzinga,https://finance.yahoo.com/news/elon-musk-says-project-stargate-193016375.html,2025-01-23 12:30:16,STORY,"SFTBY, ORCL, NVDA",yahoo,0.4,Bullish,Tech
GME,GameStop makes a drastic move amid weak sales,No summary available.,TheStreet,https://finance.yahoo.com/m/5f79ebb7-890b-3980-9111-eab5ba93e84e/gamestop-makes-a-drastic-move.html,2025-01-23 14:37:00,STORY,GME,yahoo,0.4,Bullish,Tech
GME,Hindenburg Research shutting down highlights 'wear and tear' of activist short-selling,No summary available.,Yahoo Finance,https://finance.yahoo.com/news/hindenburg-research-shutting-down-highlights-wear-and-tear-of-activist-short-selling-143652817.html,2025-01-22 07:36:52,STORY,"GME, AMC, SMCI, NKLA, IEP",yahoo,0.4,Bullish,Tech
MU,Why Micron (MU) Stock Is Nosediving,No summary available.,StockStory,https://finance.yahoo.com/news/why-micron-mu-stock-nosediving-200717207.html,2025-01-23 13:07:17,STORY,"NVDA, MU",yahoo,0.4,Bullish,Tech
MU,Is Micron Technology (MU) Among the Undervalued Semiconductor Stocks to Buy According to Analysts?,No summary available.,Insider Monkey,https://finance.yahoo.com/news/micron-technology-mu-among-undervalued-192234884.html,2025-01-23 12:22:34,STORY,MU,yahoo,0.4,Bullish,Tech
MU,Why Micron Technology Stock Is Sinking Today,No summary available.,Motley Fool,https://finance.yahoo.com/m/296c31ad-a0d3-3cf7-a6ac-f231e0880a55/why-micron-technology-stock.html,2025-01-23 12:18:25,STORY,"MU, NVDA",yahoo,0.4,Bullish,Tech
MU,Chip stocks fall as Nvidia supplier highlights market uncertainty,No summary available.,Yahoo Finance,https://finance.yahoo.com/news/chip-stocks-fall-as-nvidia-supplier-highlights-market-uncertainty-150914100.html,2025-01-23 08:09:14,STORY,"AVGO, 000660.KS, AMD, NVDA, ARM, MU, ^SOX",yahoo,0.4,Bullish,Tech
MU,"If I Could Buy Only 1 AI Stock, This Would Be It",No summary available.,Motley Fool,https://finance.yahoo.com/m/4691bfbc-9160-39de-975b-64f988ffe5f9/if-i-could-buy-only-1-ai.html,2025-01-23 06:43:00,STORY,MU,yahoo,0.4,Bullish,Tech
MU,Why Is Prem Watsa Bullish On Micron Technology (MU) Now?,No summary available.,Insider Monkey,https://finance.yahoo.com/news/why-prem-watsa-bullish-micron-131007100.html,2025-01-23 06:10:07,STORY,"MU, FAXRF",yahoo,0.4,Bullish,Tech
MU,Nvidia Supplier SK Hynix Posts Record Profit on AI Boom,No summary available.,The Wall Street Journal,https://finance.yahoo.com/m/c113e845-ba87-37ec-8dac-6b5077351de4/nvidia-supplier-sk-hynix.html,2025-01-22 19:04:00,STORY,"MU, NVDA",yahoo,0.4,Bullish,Tech
TSLA,The Trump-Musk Bromance Is as Strong as Ever Despite Tesla CEO’s Stargate Diss,No summary available.,Barrons.com,https://finance.yahoo.com/m/7f8f9de8-7e66-3265-86a9-f5e837271050/the-trump-musk-bromance-is-as.html,2025-01-23 14:36:00,STORY,"TSLA, ORCL, NVDA",yahoo,0.4,Bullish,Tech
TSLA,Tesla Just Raised Prices in a Key Market. What It Means for the Stock.,No summary available.,Barrons.com,https://finance.yahoo.com/m/ae1edaef-311a-3a14-92ed-52c74ba69ec5/tesla-just-raised-prices-in-a.html,2025-01-23 14:16:00,STORY,TSLA,yahoo,0.4,Bullish,Tech
TSLA,Is Tesla Stock A Buy Or A Sell Amid Donald Trump's White House Return And Q4 Earnings?,No summary available.,Investor's Business Daily,https://finance.yahoo.com/m/7ba4c6e9-e00c-3c14-a4f5-caaf8dfbc5b9/is-tesla-stock-a-buy-or-a.html,2025-01-23 14:03:12,STORY,TSLA,yahoo,0.4,Bullish,Tech
TSLA,"Top Research Reports for Tesla, UnitedHealth & Oracle",No summary available.,Zacks,https://finance.yahoo.com/news/top-research-reports-tesla-unitedhealth-200900658.html,2025-01-23 13:09:00,STORY,"ORCL, TSLA, UNH, ETST, ETN",yahoo,0.4,Bullish,Tech
TSLA,"Tesla Expected to Temper Vehicle Sales Growth Expectation, Oppenheimer Says",No summary available.,MT Newswires,https://finance.yahoo.com/news/tesla-expected-temper-vehicle-sales-180642251.html,2025-01-23 11:06:42,STORY,TSLA,yahoo,0.4,Bullish,Tech
TSLA,"Magnificent Seven Stocks: Nvidia, Tesla Slide; Meta Nears Buy Point",No summary available.,Investor's Business Daily,https://finance.yahoo.com/m/4205eaa9-f620-3a0b-a81a-0e82c7c9fd0b/magnificent-seven-stocks%3A.html,2025-01-23 10:35:42,STORY,"NVDA, AAPL, TSLA, META, MSFT",yahoo,0.4,Bullish,Tech
TSLA,Tesla Q4 Earnings Preview: What's at Stake for Investors?,No summary available.,GuruFocus.com,https://finance.yahoo.com/news/tesla-q4-earnings-preview-whats-170016428.html,2025-01-23 10:00:16,STORY,TSLA,yahoo,0.4,Bullish,Tech
NFLX,Roku Stock Sees RS Rating Climb To 79,No summary available.,Investor's Business Daily,https://finance.yahoo.com/m/1cc369f7-0b03-3e39-b0ee-c91301053ff4/roku-stock-sees-rs-rating.html,2025-01-23 15:02:00,STORY,"ROKU, NFLX",yahoo,0.4,Bullish,Tech
NFLX,Netflix Stock Is on Pace for New High. Earnings ‘Buried’ This Analyst’s Concerns.,No summary available.,Barrons.com,https://finance.yahoo.com/m/7ede30a5-d254-30d8-ab9a-8140d7d8ca17/netflix-stock-is-on-pace-for.html,2025-01-23 13:36:00,STORY,NFLX,yahoo,0.4,Bullish,Tech
